{
  "schema_version": "1.0",
  "snapshot_format": "sanitized-google-calendar-v1",
  "target_fingerprint": "aaaaaaaaaaaaaaaaaaaaaaaaaaaaaaaaaaaaaaaaaaaaaaaaaaaaaaaaaaaaaaaa",
  "event_count": 1,
  "complete": true,
  "events": [
    {
      "id": "evtfixturecancelled001",
      "iCalUID": "fixture-valid-001@example.invalid",
      "summary": "Synthetic all-day observance",
      "description": "Safe fixture description",
      "start": {"date": "2026-01-15"},
      "end": {"date": "2026-01-16"},
      "allDay": true,
      "status": "cancelled",
      "eventType": "default",
      "etag": "fixture-etag-cancelled-001",
      "updated": "2026-01-05T00:00:00Z"
    }
  ]
}
